{
  "schema_version": "task.v1",
  "run_id": "3b0e8c1a-5d2f-4e6a-9c7b-1f2e3d4c5b6a",
  "output_schema": "finding.v1",
  "data_class": "public",
  "task_id": "7c6b5a4d-3e2f-4b1a-9d8c-6f5e4d3c2b1a",
  "parent_task_id": "9a1b2c3d-4e5f-4a6b-8c7d-0e1f2a3b4c5d",
  "depth": 2,
  "requested_by": {
    "kind": "department",
    "department": "supply"
  },
  "department": "customer",
  "objective": "Steigen Tickets oder sinken Bewertungen in SP seit dem 02.01.2018, passend zum Lieferverzug?",
  "refs": {
    "kpis": [
      "review_score_avg"
    ],
    "entities": [
      {
        "type": "region",
        "id": "region:SP"
      }
    ]
  },
  "allowed_tools": [
    "bi.series",
    "bi.breakdown",
    "bi.insights"
  ],
  "budget": {
    "max_steps": 6,
    "max_tokens": 15000,
    "max_cost_eur": 0.02
  },
  "due": "2018-01-11",
  "status": "completed",
  "status_reason": null,
  "created_at": "2026-10-10T02:10:52Z",
  "completed_at": "2026-10-10T02:11:20Z"
}
